Tanggal Terbit,Judul Buku,Judul Cerpen,Editor Buku,Penulis,Gender,Corpus cerpen,Penerbit dan tempat,Sumber,Bahasa
01 May 2020,,Tak Pernah Meminta,,Ulfi nurfaizah,Perempuan,"Begitu nyenyak tidurnya Mila dan Nida, dua orang anak yang terlahir dari keluarga yang sangat sederhana. Bapaknya seorang pedagang es keliling sedangkan ibunya seorang tukang cuci pakaian. Melihat lelapnya tidur mereka, cukup membuat orang tuanya bahagia. Paling tidak, mereka tetap dapat tidur dengan nyenyak ditengah kondisi saat ini.
 
 Ya, begitu terasa berat hari-hari yang kini harus dijalani. Ditengah wabah penyakit yang mulai menyebar di seluruh kota, cukup menghambat usaha kedua orang tuanya. Bapaknya yang biasa berkeliling dari sekolah ke sekolah kini harus mencari tempat baru untuk berkeliling berjualan, karena sekolah sedang diliburkan berkaitan dengan wabah penyakit ini. Ibunya yang biasa mencuci dibeberapa tempat pun kini hanya menerima pakaian dari dua tempat saja.
 
 Pagi itu Bapak sedang sibuk memasukkan es yoghurt ke dalam tas freezerya (tas es, tas untuk menyimpan es) sambil meminum secangkir kopi susu buatan Ibu. Bapak bersiap untuk berangkat.
 
 ""Pak, mau keliling kemana hari ini?"" tanya Ibu sambil mencuci beberapa piring dan gelas yang kotor.
 ""Belum tahu Bu, sambil jalan aja nanti Bapak cari tempat untuk berjualan."" jawab Bapak singkat yang masih sibuk membereskan es-es yoghurt dagangannya.
 
 ""Hari ini mungkin lebih banyak tempat-tempat yang ditutup Pak, kalo sampai gak ada tempat gimana Pak? Uang makan tinggal sedikit lagi, baju yang Ibu cuci juga sekarang cuma seminggu dua kali.""
 
 ""Jangan pesimis gitu Bu, banyak berdo'a aja semoga hari ini ada pembeli. Gak masalah kalau banyak tempat yang ditutup, selama banyak yang belle es-es kita. Kita pasrahkan saja, Allah tidak akan tertukar dalam memberi rezeki kepada hambanya."" Bapak meyakinkan Ibu, dengan perlengkapan dagangan yang sudah siap.
 
 Ibu terdiam tanpa membalas ucapan Bapak. Tergambar diwajahnya kekhawatiran, meski Bapak telah meyakinkannya. Bapak menghabiskan minumannya, lalu pergi dan tak lupa berpamitan ""Bapak pergi ya Bu! Assalamu'alaikum!""
 
 ***
 
 Ibu sedang sibuk menyapu lantai yang terlihat cukup berdebu. Mila, anak sulungnya yang baru terbangun dari tidurnya langsung pergi menuju ke kamar mandi untuk segera berwudhu. karena jam sudah menunjukkan pukul 05.15 pagi. Mila adalah anak pertama Ibu yang sudah berusia 13 tahun. Kini dia sudah kelas 8 alias kelas 2 SMP. Sudah seminggu ini Mila diam di rumah karena sekolah yang mulai diliburkan, sebagai usaha pemerintah untuk menghindari penyakit yang kini sedang mewabah.
 
 Mila anak yang senang membantu kedua orang tuanya, biasanya Mila yang membantu membersihkan rumah di sore hari. Saat sekolah pun Mila juga suka membawa beberapa es yoghurt dagangan Bapaknya ke sekolah untuk dititipkan di kantin sekolahnya. Hasil penjualan es tersebut setengahnya menjadi uang jajan Mila sehari hari. Beruntunglah Ibu dan Bapak memiliki anak yang tidak merasa malu untuk berjuang bersama mereka.
 
 ""Ade belum bangun Mil?"" tanya Ibu saat Mila keluar dari kamar mandi, yang selesai berwudhu. Ade, sebutan untuk si bungsu Nida.
 
 ""Belum Bu. Bapak udah pergi Bu?"" tanya Mila, saat menyadari tidak ada Bapak disekitar.
 
 ""Iya, Bapak udah pergi daritadi. Sambil nyari tempat yang banyak pembelinva katanya. Mudah-mudahan aja dapat tempat bagus untuk berjualan."" Jawab Ibu.
 
 ""Aamin, tapi pagi banget Bu jam segini udah pergi.""
 
 ""Kalo siang takut gak dapat tempat mungkin Mil, kan banyak komplek-komplek yang udah ditutup juga. Jadi Bapak harus nyari warung-warung yang bisa dititipines.""
 
 Setelah mendengar penjelasan Ibu, Mila pun langsung masuk ke dalam kamarnya untuk segera shalat subuh.
 
 ***
 
 Hari mulai slang, jam di dinding sudah menunjukkan pukul 10.00. Ibu sedang sibuk menggoreng tahu di dapur. Nida pun sudah terbangun sejak tadi, dan sekarang sedang asyik bermain dengan beberapa bonekanya. Mila sibuk mengerjakan tugas yang diberikan dari sekolahnya.
 
 Tok... Tok... Tok...
 
 ""Assalamu'alaikum!"" terdengar suara seorang wanita dari balik pintu.
 
 Mil. tolong bukain dulu pintunyal"" pinta ibu yang sedang sibuk memasak.
 ""Iya Bu!"" Mila bergegas menuju ke pintu.
 
 ""Neng Mila, ada Ibu?"" ternyata Bu Yati, pemilik kontrakan.
 
 Karena sekarang sudah awal bulan, Mila tahu maksud kedatangannya.
 
 ""Ada Bu, silahkan masuk Bu!""
 
 Ibu segera menyelesaikan tugasnya di dapur, dan langusng menuju ke bagian depan rumahnya. Rumahnya memang tidak memiliki ruang tamu, karena ukurannya yang cukup kecil. Rumahnya hanya memilki 1 ruangan depan berukuran 3x3 meter. 1 kamar dengan ukuran yang sama, 1 ruang dapur ukuran 2x2 m, dan 1 kamar mandi dengan ukuran yang sama dengan dapur. Jadi, ruangan depan digunakan untuk ruang tv. ruang beraktivitas, sekaligus sebagai ruang tamu.
 
 ""Eh Bu Yati, sehat Bu?"" Sapa Ibu, sambil duduk dihadapan Bu Yatı. Ruangan yang cukup sempit. membuat jarak duduk menjadi berdesakkan antara Ibu. Bu Yati, Mila dan Nida.
 
 ""Alhamdulillah sehat Bu. Gimana Bu, pekerjaan Bapaknya anak
 
 anak sekarang?""
 ""Kurang baik Bu, beberapa hari ini susah dapetin tempat untuk berjualan. Sekolah udah libur, beberapa tempat juga ditutup. Alhamdulillah masih ada yang beli, meski gak sebanyak biasanya Bu. Saya juga mau izin, untuk pembayaran kontrakan bulan boleh ditunda sampai bulan depan Bu?"" tanya Ibu langsung ke intinya, dengan wajah yang terlihat cukup malu saat mengatakannya,
 
 ""Boleh bu, saya juga tahu sekarang kondisinya seperti ini. Siapa yang nyangka, kita harus melewati hari-hari seperti ini ya Bu. Banyak pekerja yang dirumahkan juga karena kondisi sekarang. Mudah
 
 mudahan ada rezekinya ya Bu."" ""Aamiin yaa rabbal aalamiin... makasih banyak ya Bu atas pengertiannya. Insyaallah kalo uangnya ada. saya langsung antar ke
 
 rumah ibu.""
 
 ""Iya Bu, silahkan. Kalo gitu saya pamit dulu ya Bu. Mau coba keliling lagi. Assalamu'alaikum!"" ucap Bu Yati sambil tersenyum. sambil berdiri untuk pergi dari rumah.
 
 ""Walaikumsalam warrahmatullahi wabarakatuh jawab ibu sambil menutup pintu setelah Bu Yati meninggalkan rumahnya.
 
 Bu Yati memang terkenal ramah dan baik hati. Dia seorang janda dengan 4 anak. Suaminya telah lama meninggal karena sakit. Dia memiliki beberapa kontrakan peninggalan suaminya. Dari kontrakan inilah Bu Yati menghidupi keempat anakanya yang kini sudah mulai dewasa. Anak pertama dan keduanya sudah berkeluarga. Anak ketiganya sudah bekerja di salah satu perusahaan di luar kota. Tinggallah anak bungsunya yang masih duduk di kelas 2 SMA, yang kini menemaninya di rumah. Untuk tambahan biaya kehidupannya. Bu Yati juga suka menjahit baju-baju pesanan dari para terangganya.
 
 Kontrakan Bu Yati, termasuk kontrakan termurah yang ada di daerah tersebut. Para keluarga yang mengisi kontrakannya memang memiliki tingkat ekonomi menengah ke bawah. Dengan biaya bulanan lima ratus ribu rupiah perbulan, sudah termasuk air dan listrik membuat kontrakan ini sangat terjangkau bagi keluarga yang memiliki penghasilan kecil seperti keluarga Mila.
 
 Bu Yati sangat pengertian dengan kondisi para keluarga yang mengontrak di kontrakannya. Dia tidak akan mengusir keluarga yang mengontrak dikontrakannya jika terlambat membayar. Bu Yati selalu memberikan keringanan, maksimal 3 bulan keterlambatan. Jika sudah 3 bulan masih belum membayar, terpaksa Bu Yati meminta para keluarga yang mengontrak untuk pindah dan kontrakannya tanpa harus membayar.
 
 ""Bu. Ade pengen permen! Ayo jajan yuk bu!"" ajak Nida. Usia Nida genap 5 tahun pada bulan Juni nanti. Terkadang Nida tidak tahu kondisi keluarganya saat ini. Usianya yang masih kecil membuatnya tidak mengerti dengan keadaan keuangan kedua orang tuanya. Nida sering menangis karena keinginannya yang tidak dituruti Ibu. Meski sering menangis, Nida gampang mereda lalu melupakan keinginannya setelah lelah menangis dan tertidur.
 
 ""Ya sebentar ya De, Ibu mencuci baju-baju dulu! Mau jajan sama Teteh?"" tanya Ibu (Teteh sebutan kakak perempuan dalam bahas sunda).
 
 ""Gak mau, sama ibu aja!""
 
 ""Ya udah, tunggu dulu ya. Sebentar lagi Ibu beres mencucinya!""
 
 Nida pun kembali ke ruang depan sambil menunggu ibu selesai membereskan pekerjaannya. Di ruang depan. Mila sedang asyik menonton TV tentang santapan kuliner. Mila suka menonton acara televise yang berkaitan dengan kegiatan memasak. Nida ikut serta menonton dengan Mila sambil menanti Ibu yang akan menemaninya jajan ke warung.
 
 Beberapa menit kemudian. Ibu muncul di ruang depan.
 ""De, ayo ke warung. Tapi jajannya cuma seribu ya, uang buat jajan Ade hari ini cuma ada seribu. Biar besok bisa jajan lagi."" jelas Ibu sebelum pergi keluar. Ini salah satu cara Ibu agar Nida tidak merengek minta jajan lebih saat di warung.
 
 ""ya Ibu, jajan permennya gak boleh lebih dari seribu ya Bu?""
 
 ""Iya sayang!""
 
 Ibu dan Nida pun pergi ke warung bersama. Nida memilih beberapa permen kesukaannya yang tidak lebih dari seribu rupiah. Nida pun pulang ke rumah dengan begitu ceria.
 
 ***
 
 Sore harinya setelah terbangun dari tidur siangnya, Nida kemball meminta Ibunya untuk jajan ke warung dekat rumahnya.
 
 ""Ibu... ayo jajan!"" ajaknya sambil menarik bagian bawah kaos yang Ibu pakai.
 
 ""Kan tadi siang udah jajan De. besok lagi ya?"" ibu yang tadinya berdiri, kini membungkuk sambil memegang bahu Nida mencoba menenangkannya.
 ""Tapi Ade mau jajan lagi Bu...."" Nida mulai memaksa.
 
 ""Uang untuk jajan Nida udah habis. Kalo besok, uangnya ada lagi. Ibu buatkan bola-bola ubi ya? Kan sama-sama manis rasanya, kayak permen juga."" tawar Ibu, mengingat beberapa hari lalu sempat dibawakan sekilo ubi manis dari adik perempuannya yang sempat berkunjung ke rumah.
 
 ""Bola-bola ubinya dikasih gula merah ya Bu didalamnya?"" tanya Nida.
 
 ""Tya ibu kasih gula merah dalamnya.""
 
 ""Ade mau yang banyak gulanya ya Bu!""
 
 ""Iya sayang, buat Ade gula merahnya yang banyak. Ibu kukus ubinya ya, nanti klo udah matang Ade bantu Ibu membuat bola-bola ubinya ya..."" ucap ibu sambil mengusap kepala Nida.
 
 ""Siap Bu!"" jawab Nida sambil tersenyum senang.
 
 Mila yang sedari tadi duduk di depan TV, bergegas pergi ke dapur untuk membantu ibu menyiapkan ubi-ubi yang akan dikukus. Sedangkan Nida. segera duduk di depan TV menggantikan posisi. какaкпуа. меncari acara TV yang menarik baginya, seperti biasa pada sore hari Upin Ipin sudah siap dilayar kaca.
 
 Setelah ubi-ubinya selesai dikukus, dan sudah dibersihkan dari kulitnya, Ibu yang menghancurkan ubi-ubi tersebut. agar ubi-ubi tersebut gampang dibentuk. Sedangkan Mila sedang sibuk memotong beberapa gula merah sebagai isian bola-bola ubi nantinya. Setelah semua adonan siap. Ibu dan Mila segera berkumpul di ruang depan.
 
 ""Ayo sini De, bantu Teteh sama Ibu bikin bola-bola ubinya!"" ajak Mila, sambil meletakkan piring kosong serta gula merah yang sudah disiapkannya di depan Nida.
 
 ""Iya Teh! Ade yang isi gulanya ya!"" ucap Nida begitu semangat.
 
 Ibu, Mila, dan Nida pun sibuk membuat bola-bola ubi di ruang depan. Acara Upin Upin pun hanya sekedar menjadi backsound dibalik kesibukan mereka. Meski hanya berdiam saja di rumah, hal ini menjadi kegiatan yang menyenangkan bagi mereka.
 
 ***
 
 ""Assalamu'alaikum!"" terdengar suara Bapak di depan pintu.
 
 Jam di dinding sudah menunjukkan pukul 6 lewat 15. Diluar sana juga langit terlihat cukup gelap. Ibu sedang sibuk mempersiapkan bola-bola ubi yang baru saja selesai di goreng. Mila sedang melipat
 mukenanya, karena baru saja selesai solat maghrib. ""Walaikumussalam warrah matullahi wabarakatuh!"" jawab Ibu dan Mila serentak. Nida sedang buang air kecil di kamar mandi, jadi
 
 tidak ikut menjawab salam dari Bapak yang baru saja tiba di rumah.
 
 Bapak menyimpan tas esnya di samping TV, melepas jaketnya dan menggantungnya dibalik pintu kamar. Bapak pun segera bergegas ke kamar mandi setelah melihat Nida keluar, dia segera berwudhu karena belum mengerjakan shalat maghrib.
 
 Sambil menunggu Bapak menyelesaikan shalat maghrib, Ibu sedang mengganti pakaian Nida menjadi pakaian tidur. Sedangkan Mila, sedang mengeluarkan es-es dari tas es Bapak dan memasukkannya ke dalam kulkas kecil yang berada di dekat pintu dapur. Ya, setiap hari memang Mila lah yang membantu Bapak membereskan es jualannya yang belum terjual.
 
 ""Pak ini, liat! Ade tadi sore bikin bola-bola ubi sama Ibu dan Teteh! Enak loh Pak!"" ucap Nida saat melihat Bapak keluar dari kamar, sambil menunjukkan bola ubi yang cukup besar di tangan kanannya..
 
 ""wah... hebat sekali anak Bapak! Jago membuat makanan ya? Sini Bapak mau nyicip!"" puji Bapak sambil mengangkat tubuh Nida yang mungil, lalu duduk diatas pangkuannya. Bapak mengambil satu bola ubi yang ada dihadapannya. Nida terlihat senang makan bersama Bapak sambil dipangku olehnya.
 
 Mila yang baru saja selesai membereskan es-es, segera ikut bergabung di ruang depan. Ikut serta menyicipi bola-bola ubi yang dibuatnya tadi sore. Bola-bola ubi yang masih hangat itu pun menjadi makan malam yang cukup mengenyangkan bagi mereka.
 
 ***
 
 Waktu sudah semakin malam, Mila dan Nida sudah tertidur lelap di kamarnya. Tinggallah Bapak dan Ibu yang masih berada di ruang depan. Bapak sedang merebahkan tubuhnya dilantal, dengan wajah yang menghadap ke langit. Sedangkan Ibu sedang menyetrika beberapa baju Mila dan Nida.
 
 ""Pak, gimana jualan esnya?"" tanya ibu sambil menyetrika.
 
 ""Alhamdulillah terjual beberapa Bu, meski ga banyak. Soalnya Bapak gak dapat tempat untuk menitipkan es-es kita. Dijalanan juga semakin sepi. Tadi juga yang beli ada di dekat pom bensin."" Jawab Bapak menjelaskan.
 ""Dapat berapa hari ini Pak? Uang untuk makan tinggal lima puluh ribu lagi, mungkin cukup untuk tiga sampai lima hari Pak. Alhamdulillah beras masih banyak.""
 
 ""Dapat dua puluh ribu Bu, ini juga belum bisa kita pakai. Harus disimpan dulu sampai modal bikin es terpenuhi Bu. Mudah mudahan besok pembelinya lebih banyak ya Bu. Kita banyak berdo'a saja.""
 
 ""Ya, aamiin Pak.""
 
 Bapak pun tertidur setelah menyelesaikan pembicaraannya dengan Ibu. Bapak terlihat cukup kelelahan, setelah seharian berkeliling menjual es-esnya. Ibu masih sibuk menyetrika pakaian. namun tak lama setelah itu Ibu pun masuk kamar dan tidur bersama Mila dan Nida.
 
 ***
 
 Untuk hari ini, Bapak pergi agak slang. Seperti biasa, Bapak mempersiapkan semua perlengkapan jualannya dan bergegas berangkat sebelum matahari tinggi. Penuh harap tentu dalam pikirnya. Karena hanya harpaan serta usahanya lah yang dapat menghasilkan pundi-pundi rupiah untuk menghidupi keluarganya.
 Hari ini pun seperti hari-hari sebelumnya. Tanpa pergi keluar rumah, Ibu, Mila, dan Nida melakukan beberapa kegiatan di rumah. Setelah kemarin membuat bola-bola ubi, kini Ibu meminta bantuan anak-anaknya untuk menyiapkan sayur kangkung kesukaan Bapak. Setiap memasak, Ibu mengikutsertakan Mila dan Nida agar tidak terlalu bosan dengan hanya menonton TV di rumah.
 
 ""Bu... Bu... Assalamu'alaikum!"" tiba-tiba terdengar teriakan seseorang dari luar rumah tanpa mengetuk pintu.
 
 Ibu yang cukup kaget, segera keluar rumah
 
 ""Walaikumussalam Pak RT! Ada apa?"" tanyanya.
 
 ""Pak Dandi keserempet motor di sebrang pom bensin perempatan But Sekarang sedang dibawa ke rumah sakit!"" jelas Pak RT. Dandi adalah namanya Bapak.
 
 ""Inalillahi! Rumah sakit mana Pak? Saya segera kesana!""
 
 ""Rumah sakit Cahaya Bul Mari, saya temani Bu!
 Ibu segera masuk ke dalam rumah, mengganti pakaiannya dengan terburu-buru. ""Mil, titip Ade ya! Bapak keserempet motor, Ibu mau ke rumah sakit jemput Bapak!"" pinta Ibu kepada Mila yang baru saja selesai shalat Ashar.
 
 ""Inalillahi, iya Bu, hati-hati di jalan Bu!""
 
 Ibu ditemani Pak RT segera pergi ke Rumah Sakit Cahaya tempat Bapak dirawat. Bapak tergeletak diatas kasur pasien di ruang IGD. Ibu melihat kaki Bapak cukup banyak darah sedangkan tangan dan wajahnya hanya lecet saja. Semua biaya rumah sakit ditanggung oleh pengendara motor yang menyerempetnya. Untunglah dia mau bertanggung jawab. Jika tidak, darimana biaya yang harus dikeluarkan Ibu dan Bapak. Dokter menjelaskan bahwa kakinya baik-baik saja, tapi Bapak tidak diperbolehkan untuk berkativitas dulu sampai kakinya membaik. Ibu merasa bersyukur dengan penjelasan Dokter, bahwa kaki Bapak baik-baik saja meski harus istirahat penuh di rumah.
 
 Sesampainya di Rumah...
 
 Ibu dan Pak RT membaringkan Bapak diatas kasur. Mila dan Nida hanya melihat Bapak dari kejauhan.
 ""Saya pamit dulu ya Pak Dandi! Ini tas esnya, semoga cepat sembuh ya Pak!"" ucap Pak RT sambil menaruh tas es didekat pintu kamar.
 
 ""Iya Pak RT, terimakasih!"" balas Bapak, dengan suara lemah.
 
 ""Iya terimakasih banyak ya Pak!"" tambah Ibu.
 
 ""Mila sama Ade hari ini kita tidur disini dulu ya, biar Bapak bisa istirahat."" ucap Ibu sambil menutup pintu kamar. Ibu, Mila, dan Nida pun berbaring tidur di ruang depan dengan beralaskan selimut dan berselimutkan sarung milik Bapak.
 
 ***
 
 Rasanya cukup berat hari ini untuk dilewati. Bapak saat ini tidak bisa berjualan karena sakit. Ibu pun tidak bisa menggantikan posisi Bapak untuk berjualan karena harus merawat Bapak. Mila dapat membaca kondisi keluarganya saat ini. Sambil membawakan air putih ke dalam kamar untuk Bapak. Mila meminta izin kepada ibu dan
 
 Bapak yang sekarang sedang ada di dalam kamar juga. ""Bu, Pak. Teteh aja yang berjualan ya? Kalau kita gak jualan, nanti esnya kadaluarsa. Kan sayang kalau kadaluarsa.""
 ""Kamu masih kecil Mil, bahaya kalau kamu berkeliling kesana kemari berjualan."" Jawab Ibu.
 
 ""Jualannya gak akan jauh-jauh Bu, Mila ketuk pintu tetangga
 
 sekitar sini aja untuk menawarkan es kita. Boleh ya Bu?"" jelas Mila.
 
 Ibu dan Bapak saling memandang. ""Kamu gak malu jualan es ke tetangga?"" tanya Bapak yang masih dengan suara lemahnya.
 
 ""Gak malu Pak, kan Mila berjualan bukan mencuri. Mudah mudahan aja tetangga banyak yang suka es kita.""
 
 ""Ya udah, boleh. Tapi sebelum maghrib harus udah di rumah ya?
 
 Gak baik anak perempuan diluar malam-malam.""
 
 ""lya Bu! Siap!"" Mila mengakhiri pembicaraannya dengan Ibu dan Bapak.
 
 Akhirnya. Mila mendapatkan izin untuk berjualan berkeliling disekitar rumahnya. Setiap jam 10 pagi, setelah menyelesaikan tugas tugas dari sekolahnya Mila berangkat membawa beberapa es di tas es milik Bapaknya. Dari pintu ke pintu diketuknya sebagai usahanya dalam mengais rezeki untuk keluarganya. Beberapa tetangga dekat membeli beberapa es miliknya. Ada juga yang menolak membeli. dengan beberapa alasan. Hal tersebut Mila lalui dengan tenang.
 beberapa cemilan. Ada seorang ibu muda dengn seorang anak
 
 perempuan balita duduk juga di samping Mila yang sedang melepas
 
 lelahnya. ""Jualan apa Dek?"" tanya Ibu Muda tersebut, melihat tas yang cukup besar berada disamping Mila.
 
 ""Jualan es yoghurt Bul"" jawab Mila ramah.
 
 ""Berapa harganya?""
 
 ""Seribu aja Bu!""
 
 ""Saya mau sepuluh ya! Rasanya campur aja. tolong bungkuskan ya! Kamu jualan es udah lama Dek?""
 
 ""Belum Bu, baru beberapa hari ini aja. Bapak saya kecelakaan. karena Ibu yang merawat Bapak dirumah, jadi saya yang menggantikan Bapak berjualan."" Jawab Mila sambil memasukkan beberapa es pesanan Ibu muda tersebut ke dalam keresek.
 
 ""Kamu tinggal dimana?"" tanya Ibu muda tersebut penasaran.
 
 ""Gak jauh dari sini Bu, di kontrakan Bu Yati.""
 
 ""Oh dikontrakan Bu Yati, gak jauh dari rumah saya dong itu. Rumah Ibu disekitar rumah Bu Yati. sekitar tiga rumah disamping
 rumah Bu Yati. Kapan-kapan boleh saya main ke rumah?"" ternyata. Ibu muda ini masih tetangga Mila.
 
 ""Boleh Bu, silahkan. Di rumah ada Ibu, Bapak, dan adik. Ini Bu es nya!"" sambil memberikan esnya kepada ibu muda tersebut.
 
 ***
 
 Beberapa hari kemudian...
 
 Tok... Tok... Tok...
 
 ""Assalamu'alaikum!"" terdengar seorang wanita mengetuk pintu rumah.
 
 ""Walaikumussalam warah matullahi wabarakatuh!"" jawab Mila sambil membukakan pintu. ""Eh Ibu!"" ucap Mila kaget melihat sosok wanita tersebut. ""Silahkan masuk Bur Mila segera mempersilahkan wanita tersebut untuk masuk ke dalam rumah.
 
 ""Alhamdulillaah nemu juga rumah mu Dek. Ibu lupa nanyain namamu waktu itu."" Wanita ini duduk sambil menyimpan dua keresek besar dipojok ruangan. Ternyata wanita ini adalah Ibu Muda yang tempo hari Mila temui di warung.
 ""Ada siapa Mil?"" tanya ibu keluar kamar yang baru selesai shalat maghrib.
 
 ""Ini Bu, tetangga Bu Yati yang pernah Mila ceritain!"" jawab Mila.
 ""Oh Ibu, makasih banyak ya Bu beli esnya banyak waktu itu!"" ucap Ibu sambil membukukan badan dan memajukan kedua tangannya untuk bersalaman. Ibu pun duduk disamping Mila tepat dihadapan Ibu Muda tersebut.
 
 ""Sama-sama Bu! Saya suka es yoghurtnya bu, suami saya juga suka. Oh iya, perkenalkan saya Santi. Kebetulan saya kesini mau mengantarkan sedikit makanan buat keluarga Ibu. Alhamdulillah ada teman-teman yang menitipkan beberapa paket sembako ditengah kondisi kita saat ini."" Jelas Ibu muda ini, yang bernama Santi sambil memberikan 2 keresek yang telah dibawanya.
 
 ""Maasyaallah, jadi merepotkan Bu Santi. Ini semua buat kami Bu?"" tanya Ibu tidak percaya dengan apa yang diterimanya.
 
 ""Iya buat Ibu dan keluarga, gak banyak Bu tapi mudah-mudahan
 
 bermanfaat buat Ibu dan keluarga.""
 
 Terimakasih banyak Bu. udah beberapa hari ini kami bingung mencari penghasilan untuk kehidupan kami sehari-hari. Alhamdulillah, Mila mau membantu kami ikut berdagang keliling disekitar sini, untuk nambah-nambah biaya makan sehari-hari. Kami cuma bisa membalas kebaikan Ibu dan teman-teman Ibu dengan do'a. Semoga selalu dilindungi Allah dari wabah penyakit, rezeki yang melimpah serta berkah ya Bu. serta mendapat pahala yang berlipat lipat."" ucap Ibu dengan mata yang mulai berkaca-kaca, suaranya pun mulai kurang jelas terdengar.
 
 Bu Santi ingin sekali memeluk Ibu, namun itu tidak bisa di lakukan karena harus menaati peraturan social distancing. Bu Santi hanya bisa memegang pundak Ibu. ""Yang sabar Ya Bu, semoga Ibu dan keluarga bisa melewati ujian ini. Semoga kondisi ini segera berlalu."" tambahnya.
 
 Akhirnya keluarga Mila mendapatkan bantuan yang tidak disangka-sangka. Dengan perhatian Bu Santi, salah satu tetangga yang baru dikenalnya. Ditengah kondisi Bapak yang tiba-tiba mengalami kecelakaan, cukup membuat ibu kebingungan untuk dapat menghidupi keluarganya. Namun, anak sulung yang begitu pengertian menjadi anugerah terindah yang dimilikinya. Mila tanpa paksaan menggantikan posisi Bapaknya sebagai tulang punggung keluarga.
 
 Tidak sedikit yang mengalami kejadian seperti keluarga Mila ini, masih banyak keluarga diluar sana yang lebih berat ujiannya. Meski kehidupannya sangat membutuhkan uluran tangan, tapi mereka tak pernah berteriak meminta bantuan. Mereka terus melangkah tanpa putus asa menjalani kehidupan ini. Mereka hanya bisa berusaha sekuat tenaga mengais rezeki, sambil terus berharap dalam do'a. Tidak semua orang dapat melihat apa yang terjadi disekitarnya. Hanya orang-orang yang peka terhadap lingkungan sekitarlah yang dapat mendengar jeritan mereka dalam pengharapan, yang dapat melihat keadaan mereka dengan hatinya, meski mereka tak meminta dengan ucapannya.",,https://www.storial.co/book/tak-pernah-meminta/1,
