Tanggal Terbit,Judul Buku,Judul Cerpen,Editor Buku,Penulis,Gender,Corpus cerpen,Penerbit dan tempat,Sumber,Bahasa
23 April 2022,,Mudik Covid,,Anang Zunaidi,laki-laki,"Korona melanda Indonesia hampir setahun. Segala aktifitas lumpuh. Proposal-proposal yang telah dibuat manusia menjadi ambyar. Suasana mencekam, ketakutan yang luar biasa. Meski berangsur manusia kembali berbenah, tapi bayangan korona layaknya Izrail sedang mencermati data antrian yang siap dijemput, siap direnggut, dan siap untuk angkut kendaraan, beroda empat manusia.

Korona merona, manusia merana. Berbagai macam teori konspirasi, analisis medis, juga para penyuka mistis, bertaburan di media yang sadis. Manusia awam hanya bisa manggut-manggut, menurut, persis burung perkutut yang mengikuti bunyi siulan dan jentikan jari pemiliknya.

Gus Parit termenung. Ia yang meninggalkan kampung halamannya demi mengadu nasib di kota, seketika buyar. Belum genap dua bulan bekerja di pabrik, kena imbas PHK. Beralih ke ojol, Gus Parit kalah saingan dengan ojol senior yang sudah punya langganan dan popularitas. Kampung halaman, rela ia tinggalkan. Emak dan dua adiknya, dengan beban kerinduan, ia juga rela menahan. Faisal, sahabat lekatnya sejak kecil, ia tega terpisahkan. Bagaimana ia tak dongkol kepada korona.

Gus Parit, gemerutuk giginya. “Jika korona makhluk kasat mata, akan kutantang ia duel. Kumaki dia sepuasnya! Kutendang “anu”nya, hingga meringis kesakitan. Biar saja! Biar korona tak bisa bereproduksi untuk melanjutkan keturunannya!”.

Gus Parit membuka dompetnya. Dilihatnya hanya beberapa lembar lima ribuan. Gus Parit kalut, uangnya hanya cukup untuk makan sampai sore. STNK sepeda motor sudah disekolahkan di pegadaian. Jam tangan pemberian almarhum bapaknya, sudah menjadi jaminan ketika bensinnya habis suatu malam. Beberapa teman dan warung makan, sudah beberapa kali Gus Parit berhutang. Mau berhutang lagi? Ah.. Gus Parit khawatir akan terlilit. Hutang adalah kehinaan di siang hari dan kesengsaraan di malam hari. Gus Parit enggan menambah hutang lagi, karena takut. Gus Parit pernah mendengar dari ustadznya dulu, bahwa orang mati syahid diampuni semua dosa kecuali hutang!

Gus Parit dalam kekalutan tingkat dewa. Sudah tidak tahu bagaimana lagi harus berbuat apa. Dalam kerisauannya yang “maha”, Gus Parit teringat emak dan dua adiknya, teringat Faisal, dan teringat kampung halamannya. Pulang? Gus Parit ingin pulang. Menjadi satu-satunya solusi yang terbersit. Segera diambilnya Hp untuk memberitahu berita kepulangannya kepada Faisal.

“Assalamualaikum, halo.. Sal! Ini aku Parit”, sapa Gus Parit kepada Faisal, sahabat kampungnya.
“Waalaikumsalam, iya Rit. Ada apa? Mo pinjem duit lagi to?” Faisal berkata di seberang.
“Hush! Buruk sangka kamu! Tapi, kalau kamu ada lebih duit, bolehlah… hahaha”
“Ooo.. dasar lidah tak bertuah! Ada apa kamu telpon, Rit?”
“Haha.. Lidah metua tuh yang bertuah! Anu.. Sal, aku ingin pulang. Sampaikan kepada emak ya.. besok aku sampai”, Gus Parit memberitahu maksudnya.
“Hah! Pulang? Kamu mau pulang ke sini? Pulang ke rumah? Kapan? Besok?”
“Iya, pulang ke rumah. Gak usah disambut lo ya. Aku bukan tokoh besar. Apalagi sambutannya melibatkan banyak orang. Bikin ricuh saja! Hahaha..”
“Jangan guyon, Rit! Siapa juga yang menyambutmu! Kamu kan dari kota, kotamu itu berada di wilayah zona merah hitam lo..”
“Terus, kenapa Sal? Gak usah juga pasang baliho, hanya untuk menyambutku, nanti diturunkan paksa sama Pak Dudung”
“Guyon saja kamu. Kamu tanya kenapa? Kamu mau menyebarkan virus korona di kampung?”
“Jadi gimana? Aku sudah tidak punya uang lagi. Masak aku ngemis, Sal?”
“Kalau mau, ya nggak apa-apa! Kamu tidak boleh pulang, Rit! Tidak boleh!”
“Waduh Sal.. Sal.. jadi gimana dong? Uangku habis nih.. gini saja, kamu hutangi aku atau aku akan pulang?”, ancam Gus Parit dan segera menutup telponnya. Faisal pun merasa iba. Ia merasa kasihan dengan nasib yang dialami karibnya.

Faisal tampak bingung. Rupanya kekalutan sahabatnya menular. Faisal segera menemui Pak RT untuk memberitahukan kepulangan Gus Parit dari kota yang berzona merah hitam. Disepakati. Gus Parit boleh pulang, asalkan mau dikarantina 14 hari, di rumah yang telah disediakan. Untuk konsumsi dan segala kebutuhan, sementara ditanggung Faisal sebagai penanggungjawab. Sambil menanti klaim Pak RT ke pemerintah Desa. Faisal yang sedang kalut, tidak berpikir jernih. Memang, kebingungan sering mengalahkan logika. Diiyakan saja, kesepakatan dengan Pak RT. Membolehkan Gus Parit pulang dengan catatan harus dikarantina.

Faisal segera memberitahu sahabatnya Gus Parit. Besoknya, Gus Parit datang langsung menuju rumah karantina yang telah disediakan dan berjanji tidak akan pergi ke luar rumah selama empat belas hari, demi keamanan dan kenyamanan kampung. Jika memerlukan apa-apa, Gus Parit akan menghubungi Faisal untuk menyediakannya.

“Sal.. aku baru tiba nih! Tenggorokanku haus banget. Minta dikirimkan es jus alpukat dong, pliss..” WA Gus Parit kepada Faisal.
Cuaca memang lagi panas-panasnya. Tampaknya matahari enggan digantikan tarian hujan. Faisal pun segera membelikan yang Gus Parit minta, kemudian menaruhnya di pagar rumah karantina. Ketika malam tiba, Gus Parit mengirimkan pesan WA kepada Faisal.


“Sal.. malam-malam gini enaknya makan nasi goreng ya..”
Faisal pun membalasnya, “Kamu itu dikarantina, jangan memanfaatkan situasi ya”
Gus Parit segera membalas, “Siapa yang memanfaatkan? Ya sudah aku tak pergi cari sendiri..”
Faisal terkejut. Kalau sampai ketahuan orang kampung bahwa Gus Parit lepas dari rumah karantina, maka ia akan dimusuhi satu warga kampung. Faisal pun segera memenuhi permintaan Gus Parit.

Sudah satu minggu lebih, Gus Parit dikarantina. Tinggal dua hari lagi, maka Gus Parit akan bebas untuk menyapa emak dan dua adiknya. Gus Parit bersyukur, selama dikarantina tidak merasa gejala-gejala yang menunjukkan bahwa terindikasi terkena korona. Gus Parit merasa sehat. Sangat sehat, tambah membuncit perutnya malah! Karena segala macam kebutuhannya dicukupi Faisal. Makanan, minuman, jajan, kuota internet, bahkan berlangganan TV kabel, untuk menikmati pertandingan bola kesukaannya. Gus Parit tampak kerasan di rumah karantina. Sedih, karena kurang dua hari ia harus “bebas”.

Berbeda dengan Faisal. Ia merasa dua hari kebebasan Gus Parit layaknya dua abad. Uang tabungannya ludes untuk membelikan segala macam keperluan Gus Parit. Faisal menyesal, mengapa dia membuat kesepakatan dengan Pak RT tentang kepulangan Gus Parit. Namun, Faisal berusaha menenangkan dirinya sendiri. Ia yakin, yang diperbuatnya akan dicatat sebagai amal kebaikan oleh malaikat. Dan bukankah Pak RT akan mengklaim, mengganti rugi keseluruhan biaya yang ditanggung Faisal? plus bonus karena dianggap sebagai relawan korona tingkat RT. Perlahan Faisal tersenyum, karena berbuat kebaikan kepada sahabatnya dan imbalan atas jasa menjaga Gus Parit selama karantina.

Malam menjelang “kebebasan” Gus Parit menelpon Faisal.
“Assalamualaikum, Sal.. besok aku bebas. Kita bisa ketemu lagi”
“Waalaikumsalam, syukur kamu gak kenapa-napa, Rit”, Faisal malas menjawab. Karena ia tahu, kalau Gus Parit menelpon, pasti ada sesuatu yang diinginkannya dan Faisal harus segera memenuhinya. Karena kalau tidak, Gus Parit mengancam akan keluar dari rumah karantina.

“Hei.. suaramu ko lemes gitu. Jangan suuzan. Aku saat ini tidak perlu apa-apa”, Gus Parit merasakan kecemasan sahabatnya.
“Syukuurr.. kalau tidak mau apa-apa. Ada apa kamu telpon malam-malam?”
“Sepi, Sal.. Di rumah ini aku sendiri. Gak ada teman ngobrol”
“Ya jelas. La wong kamu masih dikarantina. Rame ya di Amerika sana”
“Haha.. Indonesia juga rame tuh, mang ngaruh ya sama nasib kita?”
“Haha.. jelas gak ngaruh. Ya ikut-ikutan trending aja, biar rame. Sudah ya aku ngantuk”

“Eh.. Sal, belum selesai nih. Perutku lapar nih, nggak bisa tidur” Gus Parit mulai berterus terang.
“Ha.. apa, Rit? Tampar? Halo.. halo.. sinyalnya putus.. halo.. tuut.. tuuutt..”, Faisal buru-buru menutup telponnya.
Gus Parit mendengus kesal. Ia tahu Faisal akal-akalan saja. Gus Parit pun memaksa tidur dengan perut yang lapar melilit.

Keesokan paginya, hari masa karantina habis. Gus Parit melenggang pulang ke rumah untuk menemui emak dan dua adiknya. Setelah melepas kerinduan, Gus Parit menemui sahabatnya Faisal. Mereka pun ngobrol dengan asik.

“Waduuh… pagi-pagi sudah ke sini. Mau minta sarapan ya?”, sapa Faisal kepada Gus Parit yang baru saja membuka pintu.
“Sal.. Sal.. suuzan terus. Daaann.. suuzanmu memang benar. Apa nih menu sarapan ibumu?”
“Sudah cari saja sendiri di dapur sana. Aku puasa sunah, nih…”, Faisal meminta Parit.

Sehabis sarapan, Faizal mengajak Gus Parit untuk menemui Pak RT, dengan maksud ingin mengklaim biaya yang dihabiskan selama merawat Gus Parit selama di rumah karantina, tentu saja plus bonus. Faisal tersenyum, membayangkan uang klaim akan diterimanya.

Setelah sampai di rumah Pak RT, Faisal tidak menemukan Pak RT. Kata istrinya, suaminya sedang menuju kelurahan. Faisal tersenyum dan berpikir, “Pasti Pak RT sedang mengurusi urusan klaim-mengklaimku!”. Faisal dan Gus Parit bergegas menuju kantor kelurahan. Sesampai di sana, Pak RT tidak ada. Kata petugas kelurahan, Pak RT memang tadi ke sini, tetapi langsung menuju ke sawah. Faisal menggerutu. Sudah puasa, berjalan kaki menuju rumah Pak RT dan kelurahan, kini harus mencari ke sawah.

“Sudah.. cari saja, Sal! Ayo kita cari ke sawah. Aku temani”, Gus Parit menenangkan Faisal.
Faisal mengiyakan. Bagaimana pun klai harus cair. Uang sudah ludes, kesabaran merawat dan memenuhi kebutuhan Gus Parit masa karantina harus terbayar dengan bonus.

Mereka berdua menuju sawah Pak RT. Ternyata Pak RT memang ada. Merekapun bercakap di pematang sawah.
“Gini, Pak RT. Saya mau menanyakan klaim uang karantina saya.” Faisal membuka percakapan.
“O..soal duit karantina itu. Tadi sudah aku tanyakan ke kelurahan”, Pak RT menjawab pertanyaan Faisal.
“Jadi, gimana Pak? Kapan cairnya? Bonusnya berapa, pak?” Faisal menyerbu dengan rentetan pertanyaan.
“Ooo.. sabar.. sabar.. Dengarkan penjelasan saya dulu, le. Jadi gini, memang ada klaim dan bonus, tenang saja! Tapi..”
Faisal memotong, “Tapi, apa Pak? ”, insting Faisal mulai tidak enak. Perutnya yang lapar mulai bergejolak. Kerongkongan yang mulai kehausan, tiba-tiba menjadi tersekat. Kepalanya mulai pusing, karena menahan lapar dan lelah karena berjalan jauh.
“Tapi.. menunggu dana desa turun lagi. Kalau untuk tahun ini sudah habis untuk alokasi yang lain. Jadi, ya paling cepat Januari, gimana?” jelas Pak RT kepada Faisal.

Faisal tidak bisa menjawab apa-apa. Pandangannya semakin berkunang-kunang. Ia melihat Gus Parit yang tersenyum-senyum geli, semakin panaslah hatinya. Perutnya semakin meraung-raung minta diisi. Mata Faisal mulai rabun. Hatinya semakin tersiksa.

“Kamu sehat, le..” tanya Pak RT kepada Faisal.
Karena yang ditanya hanya diam, Gus Parit segera menjawabnya, karena takut dianggap tidak sopan kepada pejabat pemerintah, meski tingkat RT.
“Sehat, Pak. Alhamdulillah. Bahkan tambah gendut, nih buktinya…” jawab Gus Parit sambil menunjukkan perutnya yang buncit di balik kaosnya. Faisal diam. Memahami dan menghayati penderitaan lahir dan batinnya. Pandangannya semakin berkunang.
“Hahaha… Bukan kamu, Rit. O ya, Sal.. Di desa kita, berdasarkan kesepakatan Karang Taruna menyumbang untuk korban korona di wilayah kota.
“Haha..” Faisal tiba-tiba tertawa sendiri.
Pak RT melanjutkan, “Dan, kamu saja yang belum bayar.”
“Haha..” Faisal tertawa lagi tanpa ada pandangan yang lucu.
Pak RT melanjutkan lagi, “Beruntung kamu ke sini, jadi aku tidak perlu repot-repot pergi ke rumahmu”.
“Hahaha..” tawa berat dari Faisal dengan mata mendelik. Tubunya terguncang. Dipaksanya tersenyum. Kemudian ambruk. Semaput.",,http://cerpenmu.com/cerpen-kehidupan/mudik-copid.html,
15 April 2022,,Asyiknya Belajar dari Rumah Bersama Keluarga DI Masa Pandemi Covid 19,,Panji Wismaya,laki-laki,"Mulai awal tahun 2020 pandemi covid 19 melanda seluruh dunia. Hal ini semakin mengubah cara hidup kita. Dari yang semula bertatap muka secara langsung sekarang harus menjaga jarak bahkan harus selalu memakai masker kemana-mana. Adanya penyakit disebabkan virus covid 19 sangat membahayakan karena menular sangat cepat dan dapat mengakibatkan kematian. Oleh karena itu banyak himbauan untuk tetap berada di rumah apabila tidak ada hal yang penting dilakukan di luar rumah, sekolah tidak lagi dilakukan secara tatap muka karena akan membahayakan peserta didik maupun guru.

Aku biasa dipanggil Rahmat, nama lengkapku sebenarnya Rahmat Nur Hadi. Aku pelajar SMP di Makassar, anak ke dua dari empat bersaudara. Kakak pertamaku adalah seorang youtuber yang subscribernya sudah mencapai seratus ribu subscriber, adik pertamaku juga masih SMP, dia adalah siswa yang berprestasi, diantara prestasinya yaitu menjuarai olimpiade sains nasional juara pertama, juara 1 lomba lukis nasional, dan menjadi ketua osis di sekolahnya. Adik bungsuku masih bersekolah di SD, dia adalah anak yang energik. Dia menjadi anggota klub sepakbola dan menjadi kapten di timnya. Coach memilihnya menjadi kapten karena sering mencetak gol dan assist. Dia juga menjadi ketua kelas. Ibuku adalah seorang pegawai negeri sipil, dan ayahku adalah seorang programmer.Itulah gambaran keluargaku, bisa dibayangkan rumahku cukup ramai dengan 6 anggota keluarga.

Pada awal belajar online aku sangat bingung bagaimana cara menggunakan bermacam aplikasi di laptop. Sebelumnya aku hanya melihat saja kalau ayah dan kakakku bekerja dengan laptop mereka. Dengan adanya keharusan belajar dari rumah maka mau tak mau aku juga harus bisa menggunakan laptop, lalu aku bertanya ke ayahku, “Ayah bagaimana cara menggunakan aplikasi zoom?” Lalu ayahku menjawab “Pertama-tama kamu sign in aplikasi zoom dulu setelah itu kamu masukkan meeting id lalu masukkan passcode lalu kamu bisa oncam dan on mic kamu dengan cara menekan tombol mikrofon dan kamera lalu kamu bisa bertemu dengan guru dan teman mu”, “Ouh begitu ayah terima kasih”, lalu aku melakukan pertemuan dengan temanku. Aku sangat senang sekali bisa bertemu dengan guru dan temanku walau tidak bertatap muka.

Setelah aku melakukan zoom dengan guru dan temanku, adikku berteriak, “Kak, gantian ya.. sekarang aku mau melakukan zoom dengan guru dan temanku” ucap adikku, setelah melakukan zoom aku langsung mengerjakan tugasku melalui word pada awalnya aku bingung cara menggunakan word, lalu aku bertanya dengan ayahku tapi ayahku sedang melakukan zoom penting dan tidak mau diganggu, lalu aku bertanya ke kakakku, “Kak bagaimana cara membuat tabel?”, lalu kakakku menjawab “pertama-tama kamu harus ke menu insert dulu setelah itu kamu pilih ke menu tabel, lalu kamu bisa memilih bagaimana tabel yang kamu mau”, “Ouhhh begitu kak terima kasih”, lalu kakakku menjawab, “Sama-sama”, lalu aku mengerjakan tugas ku dengan cepat karena sudah bisa membuat tabel di word dan tidak perlu lagi mengerjakan di kertas tinggal klik sana dan klik sini jadi dehhh.

Setelah 3 bulan aku pun menjalani Penilaian Tengah Semester satu, aku sudah belajar semua materi tinggal bagaimana cara mengerjakan Penilian Tengah Semester tersebut, aku kira Penilian Tengah Semester jawabannya ditulis dikertas ternyata cara mengerjakan Penilaian Tengah Semester berbeda karena mengerjakan di laptop atau hp, jika mengerjakannya di kertas saja dan dikirim fotonya gurunya pasti akan susah menilainya apalagi kalau tulisan anak jelek, akhirnya sekolah saya pun memutuskan menggunakan aplikasi google form supaya guru lebih enak menilai hasil Penilain Tengah Semester tersebut, aku pun kaget jika Penilaian Tengah Semester menggunakan google form karena aku sudah terbiasa menulis jawaban di kertas lalu kirim ke gurunya saat penilain harian.

Aku pun mulai mengerjakan semua soal Penilain Tengah Semester dengan lancar karena dihari sebelumnya aku sudah belajar. Ternyata mengerjakan Penilaian Tenga Semester di google form lebih gampang karena hanya tinggal meng klik jawaban yang benar dan jika aku sudah selesai aku pun tinggal menekan tombol submit atau kirim, dan satu fitur yang aku sukai dari google form adalah nilaiku langsung keluar jika aku menekan tombol kirim atau submit.

Setelah selesai Penilaian Tengah Semester aku mencoba membantu kakakku untuk membuat video youtube dan adikku juga membantu membuat video edukatif, aku menjadi bagian yang menuliskan naskah, kakakku bagian editing, dan adikku bagian mencari ide, akhirnya video kami sudah jadi dan tinggal diupload kami pun bersama-sama mengucapkan “Bismillahirrahmannirrahim” lalu kami mengupload video tersebut.

Satu jam pertama yang menonton hanya baru seribu orang karena kami membuat video itu dimalam hari kami pun segera tidur karena sudah sangat lelah dan mengantuk, pada keesokan harinya kakakku mengecek videonya kembali lalu kakakku terkejut dengan jumlah viewers yang mencapai satu juta viewers lalu kakakku memanggil aku dan adikku yang pada waktu itu aku dan adikku sedang makan sambil menonton tv, kakakku bilang “Dik jumlah viewer kita sudah mencapa satu juta viewer”, lalu aku dan adikku menjawab “Hah yang bener kak?”, lalu kakakku menjawab “liat aja sendiri” lalu aku dan adikku melihat komputer kakakku dan ternyata memang betul jumlah viewernya satu juta orang. Aku, kakakku, dan adik ku sangat dan kami sama-sama mengucapkan ‘Alhamdulillah’.

Setelah kejadian satu juta viewer tersebut sekolahku mengadakan lomba membua cerpen yang bertema “Peran Pemuda Milenial di Masa Pandemi, aku pun mengikuti lomba membuat cerpen tersebut, aku mengikuti lomba cerpen tersebut karena aku sudah terbiasa menulis kata dengan banyak, aku pun harus melawan teman baikku yang bernama Raden Roro Alulaninda Azzahra Aquen atau yang biasa dipanggil Alula, aku dan Alula mengikuti lomba tersebut karena ingin masuk ke SMA favorit di Makassar, oiya aku lupa memberitahu jika aku menang lomba sampai tingkat walikota aku pun bisa memilih SMA yang penting masih SMA tersebut masih ada di Makassar.

Aku pun menjalani lomba tersebut dengan bersungguh-sungguh mengikuti lomba ternyata usaha tidak mengkhianati hasil aku pun juara ke dua setelah Alula, aku sangat senang tapi aku ingat ini baru tingkat sekolah belum mencapai tingkat walikota, di tingkat kecamatan ternyata lombanya lebih sulit daripada yang aku kira peserta harus membuat video sambil membuat cerpen karena kakakku seorang youtuber aku pun bisa membuat video yang diminta panitia, akhirnya dengan kerja keras aku pun berhasil menjadi juara satu mengalahkan Alula yang menjadi juara dua, aku sangat berterima kasih dengan Alula karena dialah motivasiku untuk menjadi sang juara akhirnya aku dan Alula sama-sama di satu SMA yang sama.


Berkat ketekunan, rajin belajar dan saling memotivasi, aku dan Alula berhasil dalam. Setelah lulus, aku dan Alula mendapat sekolah berkualitas yang aku dan Alula inginkan.",,http://cerpenmu.com/cerpen-pendidikan/asyiknya-belajar-dari-rumah-bersama-keluarga-di-masa-pandemi-covid-19.html,
13 April 2022,,Matinya Cinta Karena Daring,,M. Falih Winardi,laki-laki,"Segelas boba manis tak mampu mengembalikan senyuman Erny. Otaknya masih berpikir bagaimana cara agar sebagian tugas kelompoknya yang seharusnya dikerjakan oleh Minda tetap bisa terselesaikan tepat sebelum tenggat waktu. Minda sudah seperti hantu yang tiba-tiba menghilang tak terlihat.

Erny masih berat menunjukkan senyumannya. Kepalanya pening akibat semalaman berpikir untuk menemukan penyelesaian dari tugas mereka. Anggota yang lain, sebut saja Ipan, Intan, dan Keman, memang sudah melakukan tugasnya masing-masing. Tetapi mereka malah lepas tangan setelah tugasnya kelar. Pikirnya, tugas selesai, pening selesai.

Beragam kalimat pedas sudah dikeluarkan dari kepala Erny menuju jari manisnya. Tapi sayang, para anggota kelompok terutama Minda, tak menganggap itu satu hal yang serius. Mereka hanya menanggapi dengan beragam stiker lucu yang entah itu berlawanan atau tidak dengan suasana hati yang mereka rasakan saat ini. Erny sempat menitikkan air mata dan berharap agar kuliah ini segera berlanjut secara tatap muka.

“Tuhan! Tatap Muka! Tatap Muka! Hamba capek daring terus Ya Tuhan!”

Segala macam doa sudah dipanjatkan kepada Erny. Beragam teman sudah di-japri-nya demi mendapatkan tempat curhat. Namun centang dua abu-abu yang tak kunjung berubah menandakan semua sedang sibuk masing-masing. Dia tak pernah menyangka jalan menuju sarjana akan seberat ini. Erny bahkan berpikir, ada enaknya jadi generasi 80 atau 90-an daripada harus jadi generasi 2000-an dan tumbuh dewasa di masa daring setan ini.

Minda yang seorang mahasiswa bersemester di atasnya, pikir Erny akan lebih membawa kemudahan dan perubahan dalam kelompok mereka. Tapi sayang, kenyataan tak bisa berjalan beriringan dengan harapan dan berhasil mencuri segala raut kebahagiaan seorang Erny dari awal fajar hingga penghujung malam yang gelap.

Dunia seakan-akan membuat Erny mati. Pikirannya makin liar dan membayangkan bahwa karena daring, orang-orang di dunia ini telah kehilangan cintanya. Telah mati bahkan tak bersisa satu pun bibit-bibit cinta pada hati para keluarga, saudara, serta teman-temannya. Separah itu pikirannya setelah Erny melihat pembaruan status Minda yang ternyata dia sedang berada di sebuah keramaian bersama seorang pria, bahkan mereka terlihat bahagia seperti tanpa ada beban yang membagi pikiran mereka.

“OH, DASAR ANAK SETAN! Gua kira dia sibuk skripsi! Ternyata lagi asoy seneng-seneng berduaan! Ga tau apa anggota kelompoknya lagi bersusah-susah begini! Dah mati apa kepekaannya? Dah ilang rasa cintanya? Mentang-mentang kagak pernah kenal! Biarin, gua mau lakuin FATALITY abis ini, liat aja MINDA!”

Singkat waktu, malam pun poek. Disamping sibuk melanjutkan tugas, Erny mendadak sibuk menulis alasan yang logis untuk segera dikirimkan ke Minda. Dia melakukan itu agar tumbuh sedikit saja kesadaran pada kakak tingkat yang diduga cantik kalau dilihat dari foto profil Zoom-nya itu. Erny perlu melakukan suatu hal, karena dia sama sekali tak memberikan balasan apapun dari awal. Seakan-akan tidak sadar kalau ada tugas kelompok.

Erny tidak berharap balasan yang baik dari Minda. Dia lebih berharap semoga pagebluk marqonah ini hilang selamanya agar bisa saling bersua dalam dunia nyata dengan teman-temannya yang sudah berpisah sejak sekitar 750 hari yang lalu. Kala bersua dalam nyata, Erny paham betul. Sekecil apapun, cinta yang nyata akan tumbuh di hati manusia yang bersua tersebut. Berbeda ketika bersua dalam jaringan, akan susah membedakan antara cinta yang nyata dengan yang maya. Erny yakin, kepekaan juga berawal dari cinta yang nyata.",,http://cerpenmu.com/cerpen-kehidupan/matinya-cinta-karena-daring.html,
