Tanggal Terbit,Judul Buku,Judul Cerpen,Editor Buku,Penulis,Gender,Corpus cerpen,Penerbit dan tempat,Sumber,Bahasa
05 February 2021,,Kamu Tidak Pernah Sendiri,,Dian Yuliantika,Perempuan,"Sudah dua jam sejak tiba-tiba saja aku terbangun dari tidur ku yang mengawang. Dari kesunyian yang mengisi kepalaku perlahan aku mendengar suara gemericik air yang merdu, ah pasti di luar gerimis. Sudah terlalu lama kota ini tidak diberkahi dengan air hujan, kasihan tanaman-tanaman yang mulai tandus. setandus jiwaku. He.... he...he...mungkin itu bisa menjadi inspirasi untuk lagu di album baru ku nanti yang entah kapan bisa aku selesaikan karena pandemi keparat ini. Semua hal menjadi kacau dan berantakan. Karena pandemi ini aku juga harus kembali kepada ketakutanku selama ini yaitu, kesendirian.
 
 ""Hai Ben, lagi apa kamu?"" aku menunggu jawaban dari seberang sana, berusaha menipu diriku sendiri.
 
 ""Ben menurut kamu mending sekarang aku makan oatmeal atau
 
 mi instan?"" aku masih menunggu jawaban dari Beno.
 
 Sudah 5 menit Beno belum juga memberi respon, sedangkan cacing di perut semakin meronta, ah dasar Beno!
 
 Ternyata kedua makanan yang aku sebutkan tadi sudah tidak ada di lemari persediaan makananku, yang ada hanya dua butir buah apel, ya lumayan lah untuk mengganjal perut hingga besok pagi. Rumah ini terasa besar dan kosong, sekosong diriku. Hahaha bila si Minces yang berisik itu ada di sini, pasti tidak akan terasa sesepi ini hidup.
 Sudah hampir sebulan penuh ini aku hidup sendiri, tepatnya terpaksa hidup sendiri dan aku selalu benci kesendirian lantaran selalu mengingatkan bahwa sebetulnya hidupku sungguh sepi dan suram jauh dari lengan-lengan panjang penuh kehangatan. Ah betul aku masih punya Beno! Benoku sayang yang paling aku sayangi dan yang selalu ada di segala masa berat dihidupku.
 
 ""Ben, aku akhirnya makan apel nih! Inget gak kamu waktu SMP dulu waktu kamu lagi tergila-gilanya sama teori Newton dan dunianya Carl Sagan? Kalau boleh jujur sebetulnya aku hampir gila waktu itu. Tiap hari kamu ngomongin bumi, matahari dan planet-planet yang gak pernah bisa kita jangkau, tapi aneh sekarang aku kangen berat dengerin dongeng kamu tentang hal-hal itu. Mungkin kalau kamu gak jadi dokter kamu bisa jadi ahli astrofisika seperti idola kamu."" Tiba tiba aku merasa mulutku lelah berbicara, aku melihat layar ponsel milikku yang memang sedari tadi gelap. Ah berat sekali hidup ini.
 
 Aku tak tahu apa saja bahan makanan yang semestinya aku beli. sebab segala urusan hidupku biasanya Minces yang selalu mengurusnya. Mungkin beberapa buah segar, beberapa kotak sayur segar dan mi instan dan serba-serbi instan cukup untuk mengisi perutku selama beberapa minggu kedepan. lebih baik beli agak banyakan untuk berjaga-jaga, enggan juga kalau harus sering keluar ""Permisi,"" seseorang menyapaku ""anu boleh minta foto bareng?""
 
 tanyanya malu-malu.
 
 Ternyata ada yang mengenaliku meskipun aku tidak mengenakan riasan apapun dan masih mengenakan setengah baju piyamaku.
 
 ""Tentu, tentu.""
 
 Aku memberikan senyuman lebarku dan pasti ia tidak melihatnya sebab aku masih menggunakan masker dan karena ia merupakan penggemarku tentu saja aku akan mencopot maskerku barang sekejap untuknya.
 
 ""Terima kasih, saya tidak menyangka Mbak Niki orangnya balk sekali."" Kata perempuan itu dengan mata berkaca-kaca.
 
 ""Ah bukan apa-apa, saya malah yang berterima kasih karena
 
 Mbak muncul saya kira semua orang sudah melupakan saya."" Kataku
 
 dengan bersungguh-sungguh.
 
 ""Mana mungkin Mbak! Setiap hari saya selalu dengerin lagu Mbak Niki. Karena lagu-lagu Mbak Niki saya bisa semangat lagi menjalani kehidupan.""
 Bila bukan karena pandemi yang aneh ini sudah pasti aku akan memeluknya, sungguh salah satu penggemar yang berkesan bagiku dan bodohnya aku lupa menanyakan namanya.
 
 ""Ben aku bener-bener gak nyangka kalau musik aku bener-bener bisa menyentuh hati orang! Bener dulu kata kamu ini salah satu jalan agar aku gak ngerasa sendiri. Terima kasih Benoku sayang.""
 
 Aku meletakan ponsel milikku yang sudah lama ini layarnya berwarna gelap. Gara-gara peristiwa tadi aku menjadi kembali bersemangat menciptakan karya-karya baru. Sudah 8 tahun ini aku berkecimpung di dunia tarik suara, awalnya aku iseng karena kata Beno suara aku bagus dan berkarakter (sungguh saat berbicara ini lagaknya seperti seorang David Foster) maka tidak ada salahnya aku mendaftar di salah satu ajang pencarian bakat di televisi nasional yang populer dan siapa sangka aku keluar sebagai juara pertama! Keajaiban pertama sekaligus kunci utama bagi diriku untuk bisa keluar dari sarang neraka. Dan entah kenapa sepertinya Tuhan juga begitu mendukung karirku sehingga setiap hari ada saja jadwal acara untukku, aku senang sibuk! Bila ada orang yang ingin bersantai dan liburan aku tidak menginginkan itu sama sekali, yang aku inginkan hanyalah bekerja, bekerja dan bekerja sebab dengan bekerja aku bisa membuat pikiranku fokus dengan sesuatu dan tidak melayang-layang ke arah yang tidak aku inginkan.
 Di atas panggung aku merasa hidup, di sana aku merasa senang dan bahagia, semua mata hanya tertuju kepada diriku. Gemerlap lampu panggung, baju-baju cantik yang tidak pernah aku pakai lebih dari sekali, alunan suara-suara asing di kupingku yang entah bagaimana caranya mereka bisa hafal hampir semua lirik lagu dari sekian album yang sudah aku luncurkan, bahkan aku saja kadang lupa lirik-lirik pasti dari lagu yang semuanya aku tulis sendiri.
 
 ""AKU KANGEN MANGGUNG!!"" teriakku pada dinding rumahku yang kokoh.
 
 Aku kira air mataku sudah kering selama beberapa tahun
 
 belakangan ini tapi ternyata ia kembali jatuh, ""AKU SEBAL DENGAN
 
 VIRUS COVID, AKU MAU NYANYI LAGI!"" aku kembali berteriak tapi
 
 bukan kepada siapa-siapa.
 
 Aku sadar aku masuk ke dalam kategori yang sangat beruntung dalam pandemi ini apalagi perkara materi tanpa bekerja sekalipun sebetulnya tabunganku sudah bisa membuatku hidup nyaman hingga hari tuaku tapi aku sungguh benci hidup sendiri seperti ini. Telepon rumah sudah lama mati, begitu juga dengan komputer dan peralatan elektronik di rumah ini semuanya tidak bisa menyala, bagaimana aku bisa menghubungi Beno coba!? Duh sebal
 
 ***
 
 Aku kembali terbangun dari tidur ayamku, ada suara nyaring dan berkumandang di bawah sana dengan liar. Orang gila macam apa itu berisik di tengah malam begini. Dengan malas aku membuka setengah mataku, pada jam dinding ku lihat ternyata jarum pendek sudah mengarah ke angka 6 dan suara itu menjadi terdengar jelas.
 
 ""Yur...sayur!!!""
 
 Baru kali ini rasanya ada tukang sayur yang lewat setelah berminggu-minggu pandemi ini. Aneh. Lebih aneh lagi karena kakiku berlari mengejar si tukang sayur.
 
 ""Bang!!"" seruku dengan suaraku yang merdu.
 
 Tukang sayur itu memutar balik gerobaknya. Kalau boleh jujur sebetulnya aku tak tahu bagaimana cara berbelanja di tukang sayur. ini pengalaman pertamaku.
 
 ""Bang sayur yang ada apa aja?""
 
 Aku menanti jawaban dari tukang sayur sambil melihat-lihat tumpukan dedaunan segar di hadapanku. Aku melirik ke arah abang penjual sayuran, ku kira ia tidak mendengar pertanyaanku tapi ternyata la sedang melongo dengan mata terbuka lebar memandangku. Sial! Memang aku setan apal Tapi aku tetap memasang senyum manis ar wajanku.
 
 ""Bang gimana?""
 
 ""Anu Non, Non itu yang penyanyi itu ya?""
 
 Wah jangan-jangan dia salah satu penggemarku juga!
 
 ""Niki maksudnya?""
 
 Tukang sayur itu mengangguk dengan bersemangat dan begitu pula dengan diriku yang mengangguk dengan tidak kalah bersemangatnya.
 
 ""Anu Non, anu...saya boleh tidak minta tanda tanganya buat anak
 
 saya...."" Tanyanya sambil mengeluarkan sebuah buku kumal dengan
 
 tangan yang bergetar hebat..
 
 ""Ya boleh dong."" Kataku seramah mungkin.
 
 Sebetulnya aku tak tahu kenapa tukang sayur itu bertingkaht seperti itu, seperti aku ini makhluk yang berbeda jenis dengan dirinya saja, tapi mungkin begitulah perasaan seorang penggemar ketika bertemu dengan idolanya, entahlah aku tak punya idola sejujurnya. Tunggu ada seorang idola di hidupku. tak lain dan tak bukan adalah Beno Samudro! Tapi aku terlalu lama mengenalnya di dalam hidupku jadi tak mungkin berlaku macam bapak penjual sayur ini.
 ""Mana spidolnya Bang?"" kataku sambil meraih buku di tangannya, aku membalik-balik lembar berisi penuh angka di buku itu dan yang tersisa adalah lembar kosong di halaman paling belakang.
 
 ""Siapa nama anak Abang?"" tanyaku masih menanti la menyerahkan sebuah bolpoin atau spidol atau apa saja lah.
 
 ""Santi, Non."" Jawabnya tergagap.
 
 ""Emang anak Abang umur berapa kok udah bisa suka sama
 
 saya?""
 
 ""Sudah SMA Non, tiap hari dengerin lagu Non. Saya aja sampe
 
 hafal.""
 
 Akhirnya ia menemukan sebuah bolpoin di dalam tas pinggangnya. Aku memberikan tanda tangan terbaik yang dapat aku berikan kepada Santi.
 
 ""Masa sih Bang? Emang lagu saya yang kaya gimana?"" tanyaku
 
 penasaran tak percaya abang ini sungguh hafal salah satu laguku.
 
 ""Gilang-gemilang cahaya abadi menantiku di ujung kota biru. anak perawan berwajah masam menanti pacar berjubah benang raja 000...riang kusambut warta dari langit ooowoowoow....""
 benar-benar membuat kupingku gatal hingga tanpa sadar aku menggaruk-garuk lubang kupingku sendiri seperti mencari-cari congek di dalamnya.
 
 ""Maaf Non jauh dari suara Non, tapi itu lagu beneran suka di putar sama anak saya,"" katanya malu-malu, ah aku jadi tidak enak hati.
 
 Karena ia sungguh hafal lirik laguku dan memiliki kepercayaan diri yang luar biasa besar maka sebagai hadiahnya aku memborong habis semua isi dari gerobak sayurnya dan sekarang aku kebingungan dengan apa yang harus aku lakukan dengan setumpuk bahan makanan di atas meja dapurku ini. Aku tau! Beno pasti tau aku harus masak apa hari ini.
 
 ""Ben, kira-kira menurut kamu aku harus masak apa hari ini? Banyak banget nih sayuran di rumah 'ku, bahkan ada yang gak aku tau namanya apa, aku mengangkat sebuah sayuran yang menurutku bentuknya aneh, sepertinya sayur ini belum pernah singgah di atas piring makanku selama ini. Sayur ini berwarna hijau keseluruhan dengan batang lurus dan ujungnya bercabang dengan ujungnya mengingatkanku pada kubah warna-warni di Saint Basil's Cathedral yang pernah aku kunjungi beberapa tahun yang lalu.
 
 Betapa rindunya aku dengan kegiatan membongkar dan menata Koper Koper yang seraru kematan itu. Beno inget gak UUIU kamu pernah pengen banget pergi ke Antartika? Dan menurut aku itu hal gila, sejujurnya sampai sekarang aku masih berpikir itu ide gila! Tapi...mungkin bila ada kesempatan aku gak keberatan pergi ke Antartika sama kamu. Aku sungguh-sungguh mengatakan ini. meskipun sejujurnya aku tak tau apa yang akan aku lakukan disana dan mungkin juga ada kemungkinan aku tidak akan pernah bisa kembali dari benua itu tapi setidaknya aku bisa bersama Beno.
 
 Aku tak tahu sekarang hari apa, bisa jadi hari Senin, Rabu atau Jumat. Setiap hari juga rasanya sama saja matahari tetap terbit dan bulan tetap tenggelam di ujung yang sama dan bintang-bintang lain. tetap terlihat jauh dari atap rumahku.
 
 Aku ingat kenangan terakhir bersama mama sebelum akhirnya ia menyerah dan kembali pada ketiadaanya. Aku senang akhirnya ia bebas dari penderitaan batinnya, tapi aku juga sedih sebab aku tak bisa menggantungkan tanganku pada siapa-siapa lagi sejak itu tapi untung saja ada Beno yang menyelamatkanku.
 
 Kalau boleh memilih aku ingin menukar tempat mama dengan tempat papa, tidak adil rasanya membiarkan orang baik mati terlebih dahulu dibandingkan orang jahat. Aku selalu merasa salah satu sekrup di otak papa pasti sudah kendor hingga ia tidak dapat berpikir dengan normal. Aku ingat bagaimana rintihan mama waktu itu
 
 memohon ampun tapi mungkin kuping papa telah menjadi tuli, ikat
 
 pinggang kulit itu tak ada hentinya mencumbu tubuh lemah mama.
 
 Mamaku memang malang. Aku ingat hari ini aku belum sempat
 
 berbincang dengan Beno.
 
 ""Beno inget gak hari pertama aku pindah sekolah?"" akhir-akhir ini Beno lebih pendiam dari biasanya.
 
 ""Aku senang guru menempatkan aku duduk disamping kamu dan aku selalu senang setiap ada yang mengejek aku kamu selalu belain aku. Ya meskipun awalnya kamu juga selalu mengejek aku setiap waktu, aku selalu senang setiap waktu yang bisa kita habiskan bersama Ben.""
 
 Aku tak tau kenapa tiba-tiba hidungku basah oleh ingus, ah sial bagaimanapun juga aku malu bila sampai Beno tau aku hampir menangis begini. Memalukan. Aku menyeka ingus yang tak ada habisnya, untung layar pada ponsel itu masih berwarna gelap. Aku berharap virus ini lekas hilang dari muka bumi. sebulan lagi begini rasa-rasanya aku bisa menjadi gila! Tapi mungkin bentuk gila yang berbeda dengan gilanya papa pastinya. Apa kabar pria tua itu sekarang ya? Aku tidak merindukannya sama sekali, tapi aku sangat berharap la merindukan mama seperti aku selalu merindukan mama setiap hari hingga rasanya rasa rindu itu bisa memelintir setiap urat di leherku.
 
 ""Bunga semboja putih warnanya bak gaun pengantin lara rasa nya...."" Barusan aku berkata apa? Ah aku ingat! Aku bisa menjadikan itu masuk ke dalam bagian lirik lagu baruku.
 
 ***
 
 Aku bangun dengan kaki seperti melayang di atas lantai kayu yang dingin. Aku bermimpi dalam sebuah mimpi. Aku teringat alasan kenapa aku ingin menjadi seorang penyanyi, menjadi seorang penghibur bagi hari yang buruk ataupun hari yang mujur bagi hidup orang lain. Aku ingin menggapai hati orang-orang itu, aku tidak ingin orang lain sampai merasa sendiri. Aku pernah merasa sendiri dan sesungguhnya hingga sekarang aku masih merasa sendiri dan
 
 memang selalu sendiri dan aku tau itu tidak enak.
 
 Aku ingat malam-malam gelap pekat tanpa bayangan dan di malam seperti itu biasanya aku akan menarik selimutku yang tebal lebih tinggi daripada mataku. pernah satu kali aku menarik selimut itu hanya setinggi mataku dan di ekor mataku yang tajam aku masih melihat darah segar mengalir dari hidung mancung mamaku yang saat itu aku biarkan tinggal seorang diri. Aku sayang mama tapi aku lebih takut kepada papa, pernah sekali aku kena tampar waktu kecil dan merah itu masih membara hingga hari ini di pipi kananku yang semakin hari semakin bertambah tertarik kedalam cekugannya. Oh ya! Pipi kiriku juga pernah kena tampar tapi bukan oleh tangan papa.
 
 Thingtuuung!!!
 
 Bel rumahku berbunyi! Adakah yang mengunjungiku? Apa yang harus aku lakukan sekarang? Tidak boleh ada yang masuk ke rumah ini! Aku tak ingin tertular virus sialan itu!
 
 Tilingtuuung!!!
 
 Ah sial, andai ada Minces sudah ku dorong tubuh bulatnya untuk menyambut orang di luar sana. Aku mengintip bagai anak perawan baru selesai mandi, ada seorang pria bertubuh seperti tiang bendera dengan wajah seperti anak kecil kurang minum susu berdiri di depan pagar rumahku.
 
 ""Iya, ada apa ya Mas?"" tubuh pria itu seperti tersentak, ia menjawab sambil mengetuk-ngetuk sepatu pantofelnya di aspal.
 
 ""Benar ini rumah Nona Niki Havetta?"" pria itu juga memiliki suara layaknya anak kecil.
 
 ""Ya betul.""
 
 ""Ada kiriman untuk Nona.""
 
 Pria itu memperlihatkan sebuah kotak berwarna coklat di tangannya. Aku berjalan dengan kaki telanjang lupa mengenakan sandal rumahku tadi. Dari dekat baru aku sadar wajah pria itu seperti anak kecil berumur puluhan tahun tapi anehnya dari wajah tuanya yang aneh aku bisa melihat wajah Arman. Aku hampir lupa dengan keberadaan Arman, dia adalah teman masa kecilku kalau tidak salah ingat ia meninggal saat aku berumur 5 tahun karena sakit DBD. Waktu kecil aku suka mencuri waktu untuk bermain dengannya, sebelum mengenal Beno aku sudah jauh menjelajahi Neverland bersama Arman yang berumur pendek.
 
 ""Halo Mbak! Halo!"" katanya membangunkan aku dari kenangan samarku bersama Arman.
 
 ""Iya Mas.""
 
 Aku mengambil kiriman itu dengan ujung jari-jariku yang lentik takut bila ada virus yang menempel pada kiriman itu atau dari orang berwajah Arman kecil ini, tiba-tiba hatiku terasa tergelitik untuk menanyakan itu. ""Apakah Mas bernama Arman?"" sejujurnya aku tak tahu jawaban macam apa yang sesungguhnya ingin aku dengar.
 
 ""Hmm saya rasa, saya bisa menjadi apa saja yang dipikirkan setiap manusia.""
 
 Aduh pria itu tersenyum tapi senyumnya membuat perut menjadi
 
 sembelit tapi aku tetap harus ramah. Aku memberikan senyum
 
 terbaikku.
 
 Aku kemba Redaran Tuan dan memberikan pengamanan terlebih dahulu pada kiriman itu dengan menyemprotkan alkohol pada kotak coklat itu, setidaknya itu salah satu cara pencegahan yang sering aku dengar di televisi dalam tidurku yang samar. Aku buka kotak itu dengan hati-hati setelah aku cari-cari kiranya adakah nama dari pemberi kotak itu tapi nihil. Perlahan aku melihat sebuah benda yang sangat aku kenali, benda yang selama ini aku sangka sudah hilang sebab tidak pernah berhasil aku temukan dimana-mana padahal sudah 'ku cari dengan sepenuh hati selama ini.
 
 Sebuah boneka jelek tugas prakarya sewaktu SMP dulu yang Beno berikan kepadaku, dibawah boneka itu terdapat sebuah kartu bertuliskan, untuk: Niki Samudro. Benar-benar terlalu Beno! Sewaktu SMP aku tak pernah sekelas dengan Beno jadi tugas prakarya kami berbeda, aku memberikan sebuah kaos bergambar cetakan tanganku dengan tambahan corat-coret tidak jelas dan aneh di sana, di sini dan di situ tapi aku sudah menganggap kaos itu bagaikan cetak biru mahakarya agung dari tangan yang aku rasa setidaknya memiliki sedikit-banyak bakat bagaikan seorang Salvador Dali.
 
 Boneka itu berdebu dengan badannya sudah compang-camping tapi aku sangat menyayanginya. Dulu sewaktu Beno beserta mama dan kakaknya setiap liburan sekolah selalu berlibur ke rumah nenek mereka di luar kota dan tentunya aku tidak akan pernah diajak, aku akan bermain dengan boneka itu seperti aku sedang bermain dengan Beno. 
 ""Ben, terima kasih ya kirimannya aku gak nyangka selama ini kamu yang nyimpen boneka ini.""
 
 Aku tersenyum seolah-olah Beno sungguh berada di hadapanku. ""Ben inget gak waktu pertama kali papa dan wanita itu kasih kamu mobil waktu SMA? Kamu selalu cerita betapa serunya rumah nenek kamu hmm Oma Merete kamu panggilnya, dan bertahun-tahun lamanya aku selalu penasaran tapi wanita itu tak mungkin mengajakku dan aku juga tak sudi pergi bila dia yang mengajak dan akhirnya kamu yang membawa aku. Nenek kamu yang Indo-Belanda yang ketika berbicara aku tak pernah mengerti dengan jelas apa yang sedang ia bicarakan tapi aku tau kebaikan dari dirimu pasti menurun dari dirinya bukan dari wanita yang kau panggil mama di rumah.""
 
 Aku kembali teringat wajah wanita itu dan bagaimana ia repot menyembunyikan wajah murka berbentuk kotak itu ketika pertama kali pindah ke rumah kami (maksudku dengan kami adalah aku mama-papa) dan dengan bergegas ia membuka semua jendela dan menyalakan kipas besar di sana-sini untuk menghilangkan aroma kepasrahan tubuh mama yang baru saja dipanggil untuk kembali mengabdi di kerajaan Tuhan. Papa senang sekali, tak pernah aku lihat bibirnya berbentuk lain selain sebuah dataran hampa, kall itu bibir papa berbentuk seperti tubuh kapal golekan lete yang pernah aku lihat di museum bersama mama.
 ""Beno, andaikata wanita itu bukan mamamu pasti di malam malam tanpa terang bulan sudah ku masukan racun tikus kedalam cangkir tehnya yang mahal. Tapi dia mama kamu bagaimana bisa aku melakukan hal itu.""
 
 Aku tak sungguh akan berlaku seperti itu, bagiku itu hanya candaan dan untung saja layar itu masih berwarna gelap, bisa gawat kalau Beno benar-benar dengar aku berbicara seperti itu bisa kurang banyak nilai aku dimatanya nanti, ya meskipun ia sudah paham seberapa busuknya jiwaku ini tapi tetap saja aku adalah wanita yang semestinya memang harus bisa menimbang sikap. Mulai sekarang boneka ini tak boleh jauh-jauh dari diriku.
 
 ***
 
 Sudah hampir 5 jam ini aku tertegun pada selembar kertas kosong di hadapanku, entah 5 jam atau berapa jam yang pasti aku tak tahu. Jam dinding di rumahku jarum kecilnya selalu menunjuk ke angka 6 terus dan aku baru sadar akan hal itu. Waktu sudah mulai kembali memusuhiku. Seingatku aku telah berdamai dengannya beberapa waktu yang lalu, ternyata la kembali memusuhiku seperti masa dulu ketika wanita itu menimpakan segala kesalahan anak pertamanya kepada diriku dan dengan begitu la mempunyai kesempatan untuk mengunci tubuhku di gudang. 
 Tentu tidak ada yang membelaku selain Beno. Papaku malah benar-benar sudah menjadi tuli dan juga matanya sudah menjadi gelap hingga kerjanya hanyalah sibuk menghitung harta warisan mama. Aku benci sendiri. Aku benci bau apek dalam gudang itu, aku benci debu yang menari nari di hidungku yang setelahnya membuat aku bersin selama berhari-hari. Aku benci wanita itu, papa dan kakaknya Beno.
 
 ""Ben aku ingat waktu SMA, waktu kamu bilang ingin jadi seorang yang dokter yang hebat dan semua orang di rumah dengan gembira mendukungnya dan aku dengan rasa iri mengejek mimpimu itu dan berakhir dengan hukuman di gudang selama semalaman. Sesungguhnya aku percaya kamu sungguh dapat menjadi seorang dokter yang kamu impikan itu. Waktu itu rasa iri di diriku sudah menutupi sayangku padamu tapi untung sayangmu padaku tidak berkurang. Aku iri. Aku iri karena ketika aku mengutarakan mimpiku ingin menjadi seorang bintang yang terang dan bersinar seperti mama semua orang di rumah menertawakan aku, kecuali kamu tentunya. Aku marah dan juga malu saat itu, untung kamu menguatkan diriku dan berkata bahwa aku bisa memeluk segala impianku dan lihatlah aku sekarang sudah menjadi bintang di atas panggung hingga tidak punya cukup waktu untuk menjumpaimu lagi
 
 Air mataku sungguh menetes sekarang, aku sungguh rindu Beno. Aku sungguh ingin pulang kepada Benoku.
 
 ""Ben inget gak waktu aku baru jadi penyanyi dulu dan udah gak tinggal di rumah? Dan kamu juga baru jadi mahasiswa kedokteran. Waktu akhirnya kamu ngekos akhirnya kita bebas, menurut aku itu masa paling bahagia di hidupku. Selalu ada Minces disisiku jadi aku 'gak pernah kesepian lagi dan juga aku bisa ketemu kamu tanpa diawasi wanita itu, senang sekali ya walaupun kesibukan kita tiada terkira waktu itu tapi hebat ya kita selalu bisa mencuri waktu.""
 
 Air mataku jatuh lagi, kenapa aku jadi lemah begini, sial.
 
 ""Beno saat waktunya tiba, aku..."" Aku...aku merasa tiba-tiba lidahku kelu. Ada sesuatu yang selama ini ingin aku utarakan kepada Beno tapi selalu gagal hingga detik ini.
 
 Kertas kosong dihadapanku tidak banyak membantu membentuk kata-kata yang ingin ku ucapkan kepada Beno dengan tepat. Dari pada tidak berisi apapun aku kembali pada hobi 'ku di masa dulu yaitu memenuhi kertas kosong dengan doodle.
 
 Tubuhku menggigil, gigiku berisik sekali aku tak bisa mengontrol gerak rahangku dan perutku juga rasanya aneh sekali.
 Aku sudah menggunakan pakalan hangat yang biasa aku gunakan bila aku bepergian ke daerah dingin dan masih juga tidak membantu. Ah apa ajalku sudah dekat? Tidak, tidak belum. Aku tidak bisa merasakan jari-jari tanganku lagi. Bagaimana ini, bagaimana? Aku belum siap mati! Aku bisa melihat pantulan wajahku di jendela rumahku yang berdebu, pucatnya wajahku. Aku merangkak menuju kamar tidurku di lantai 2 seperti seorang bayi yang baru mulai belajar berjalan.
 
 Dari dalam kamar aku mendengar tawa renyah yang aku hafal itu milik slapa. Tepat di depan kamarku, anak kecil itu menyambut kehadiranku dengan rupa risaunya, matanya selalu terisi setengah air mata yang tidak pernah kering. Rambutnya yang lurus sepinggang dibiarkannya terurai dengan gaun mini yang paling sering aku kenakan ketika kecil dulu, mama yang menjahit gaun itu sendiri buat diriku sehingga pas sekali ukurannya ketika aku pakal. Aku membiarkannya membimbing tubuhku menuju kasur, dia menyelimutiku serupa dulu tinggi menutupi mata dan kepala. Tapi kali ini rasanya nyaman sekali tidak ada kecemasan bayangan papa.
 
 Anak itu kembali dengan semangkuk besar sup hangat di tangannya yang mungil. Anak baik ia sungguh menurut seperti pesan mama dulu, tidak boleh nakal dan merepotkan. Aku memakan sup yang kuahnya tak juga kunjung habis sebab bercampur dengan air mataku yang terus mengalir. Rasa dari sup itu sungguh sama persis dengan sup yang dulu sering dimasak mama. Sudah belasan tahun. aku tidak pernah memakan sup ini tapi rasanya masih menempel di seluruh dinding mulutku dengan akurat. Dulu di rumah, bila Beno atau kakaknya sakit wanita itu selalu membuat sup serupa ini, tentu saja aku tau dia pasti mencuri resep buatan mama yang disimpannya di perpustakaan rumah kami (dulu) dan entah bagaimana aku selalu dapat mencuri kecap terhadap sup hambar itu dan aku bersyukur wanita itu tak pernah membagi sup atau makanan lain buatan tangannya sendiri kepadaku.
 
 Tubuhku mulai terasa hangat, sehangat senyum anak kecil itu. tawanya kembali terdengar renyah persis dengan tawaku bila papa sedang tidak ada di rumah dulu, barangkali saat itu ia sedang bermain cinta dengan wanita itu. Sekarang aku berbaring berduaan dengan anak itu di ranjangku yang luas dan dingin, sebetulnya aku ingin menanyakan dia dapat masuk ke rumah ini dari sisi mana, sebab seingatku semua pintu dan jendela sudah berminggu-minggu ini aku tutup dengan rapat. Aku meliriknya, matanya terpejam rapat. Aku memandanginya sebagaimana aku memandangi diriku sendiri ketika bercermin. Anak yang malang.
 
 ""Beno ingat foto kita waktu kecil? Yang di ambil di taman belakang rumah. Waktu itu rambut aku panjang, terus kakak kamu yang busuk hatinya sengaja niupin permen karetnya ke rambutku... waktu itu aku sedih banget tapi kamu dengan baiknya bersihin rambut aku dari permen-permen karet itu dan walaupun akhirnya rambutku harus dipotong pendek juga.""
 
 Aku menggenggam rambut anak itu yang persis dengan rambut panjangku sebelum terkena petaka permen karet. ""Gara-gara itu aku takut manjangin rambut aku sampai baru berani lagi pas SMA, itu pun gara-gara kakak kamu kuliah jauh dari rumah. Sejujurnya aku selalu suka kalau kamu mainin rambut aku, hahaha meskipun yang terlihat dimata kamu, aku yang selalu marah kalau kamu ngebuat rambut aku berantakan. Beno andai saja hidup kita lebih mudah, apakah kita masih bisa saling menyayangi?""
 
 Anak itu mengerang, apakah aku mengganggu tidurnya? Aku menepuk-nepuk punggung tubuh yang rapuh itu, aku ingin membuat anak itu nyaman, sebab waktu kecil aku tak pernah benar-benar merasa nyaman dengan hidup.
 
 Anak itu tak pernah bicara, tapi aku dan anak itu seperti saling terhubung dan mengerti satu sama lain tanpa ada suatu bahasa yang keluar dari mulut atau tubuh kami. Aku tau anak itu tidak bisu sebab bila tertawa, hahaha hihihi hehehe nya terdengar cukup mantap dan lantang. Sudah beberapa hari ini ia menemaniku terus.
 
 ""Hel apa Mamamu tidak mencarimu? akhirnya tanyaku keluar juga, aku sedang membantunya mewarnai gambar yang telah kami buat bersama tadi, dia menggeleng sambil memiringkan poninya yang hampir menutupi matanya.
 
 ""Kenapa?"" tanyaku masih penasaran. Anak itu memandangku sebentar dengan matanya yang bulat seperti mata kelinci.
 
 ""Sebab Mamaku lah yang menyuruhku kesini.""
 
 Wah suara itu benar-benar mirip suaraku yang kaku di masa kecil.
 
 ""Ooo apa tidak apa-apa?"" aku tidak enak hati bila sampai mama anak itu kebingungan karena bersamaku terus.
 
 ""Tentu tidak."" Katanya pasti sambil merebut pensil warna
 
 berwarna kuning dari tanganku.
 
 ""Kalau Papamu?"" tanyaku penasaran dengan nasib keluarganya. apa serupa dengan keluargaku atau tidak.
 
 ""Dia mencemaskanku saat ini, tapi mungkin sudah terlambat baginya. Sebab tidak semua dosa dapat ditebus dengan batasan hidup.""
 
 Aku mengangguk-angguk saja, pura-pura paham sebab pasti papaku tidak akan pernah begitu.
 ""Kau tak punya teman?""
 
 Sekarang aku sudah merasa cukup dengan keterampilan tangan di hadapan kami tapi anak itu masih asyik sekali sepertinya. Aku menunggu jawabannya sampai ia merasa karyanya sudah sempurna.
 
 ""Ada, satu orang.""
 
 Aku mengernyit, aneh anak selucu dia tidak punya teman, tapi aku juga tahu rasanya tidak punya teman sebab semua orang selalu melabeliku dengan julukan ""Si aneh"" di masa sekolah dulu padahal mereka tak tahu aku hanya terlalu takut berbicara dan menatap mereka, dulu di rumah bila aku terlalu banyak bicara papa akan memarahiku dengan kencang. Aku hanya bisa banyak bicara pada Mama dan Beno dan baru-baru ini pada Minces.
 
 ""Siapa?"" Aku meletakkan kepalaku di atas meja seperti cara aku meletakkannya dulu di atas meja sekolah bila aku sedang melamun di tengah-tengah jam pelajaran yang menjemukan.
 
 ""Beno Samudro.""
 
 Tubuh bagian atasku bergerak kaget dengan sendirinya
 
 ""Kau mengenalnya?"" anak itu memandangku dengan rupa ganjil.
 
 ""Tentu, karena la adalah temanku! Sahabatku serunya dengan posesif. 
 ""Bagaimana kau bisa mengenalnya?""
 
 ""Aku? Tentu aku mengenalnya ia saudara tiriku. Lalu kau kenapa namamu sekarang bukan lagi Niki yang dulu mamamu berikan padamu?""
 
 Gelas berisi air habis ku teguk seluruh isinya ""Sebab Niki Havetta nama panggungku saat ini."" Ah sial tenggorokan masih terasa haus.
 
 ""Bukan itu. Kenapa namamu juga jadi Samudro sekarang?""""
 
 Glek...aku menggunakan air liurku sendiri untuk menghilangkan
 
 rasa dahaga itu.
 
 ""Sebab aku telah mengikat janji dengan Beno. Aku yakin pipiku pasti bersemu merah sekarang.
 
 ""Lalu dimana Beno sekarang?"" tanyanya dengan wajah
 
 penasaran.
 
 Dimana Beno? Dimanakah Beno? Aku menggelengkan kepalaku dengan lemah. ""Aku tak tahu."" Sumpah ini jawaban paling jujur yang dapat ku berikan.
 Aku juga bingung dengan keberadaan Beno, rasa-rasanya sudah 6 tahun ini aku tak pernah melihat keberadaanya lagi.
 
 ""Kenapa tak kamu cari?""
 
 Hah! Jangan-jangan anak ini bisa membaca pikiranku.
 
 ""Aku tak tau....”
 
 Bibir anak itu seperti mencibirku tapi aku tak keberatan karena sungguh aku tak tahu kenapa aku tidak mencari Benoku selama ini.
 
 Aku belum tidur sejak kemarin, belum juga membersihkan atau merapikan diriku. Aku mulai mempertanyakan eksistensi ku selama ini, mengapa aku bisa berada disini dan terjebak dalam paragraf
 
 paragraf penghiburan yang aku ciptakan dalam benakku sendiri.
 
 ""Kamu mencintai Beno?""
 
 Anak itu menghampiriku dengan membawa boneka jelekku yang terkulai lemas di tangannya.
 ""Iya."" Aku kaget mendengar ketegasan yang begitu lugas keluar dari dalam tenggorokanku.
 
 ""Bukankah aneh bila kau mencintai saudara tirimu sendiri.
 
 bagaimana kiranya pendapat papa dan mamamu sendiri nanti?""
 
 Anak itu bertanya dengan wajah penuh keprihatinan yang tidak di buat-buat, ia membelai rambutku sama dengan cara mama membelai rambutku ketika kecil dulu. Aku menikmatinya, maka aku meletakkan kepalaku yang ringan ke atas pangkuannya yang kecil.
 
 ""Aku tak memiliki darah yang sama dengannya, mama Beno bukan mamaku, papanya sudah mati ketika Beno bayi. Papa dan wanita itu, maksudku mama Beno sudah tahu hubungan kami dan tentunya mereka menentangnya habis-habisan dan menghardikku seolah aku wanita lacur. padahal Beno juga mencitaiku. Kami tumbuh dalam cinta murni yang kami pupuk dari masa kanak-kanak kami. Kalau Mamaku...aku tak tahu, aku masih terlalu hijau untuk
 
 membahas asmara ketika ia..."" ""Aku rasa Mama akan menyukai Beno bila memiliki kesempatan untuk bertemu dengannya.""
 
 Anak itu memotong pembicaraanku. aku ingin marah tadinya tapi mendengar penyataan itu kutarik lagi rasa marahku.
 Bagaimana dengan Benomu? Aku menengadan dan menatap wajah mungil itu, ia menahan kepalaku agar tetap diam dan tidur di atas pangkuannya.
 
 ""Benoku sekarang juga sedang berkelana dalam pencariannya.""
 
 Anak itu menepuk-nepuk pipiku yang tidak berdaging.
 
 ""Apa yang Beno cari?""
 
 ""Kamu.""
 
 Anak itu menjawab dengan sangat cepat tidak memberikan aku jeda untuk bernapas.
 
 ""Aku? Kenapa ia mencariku dan tidak mencarimu?""
 
 Anak itu menepuk keningku dengan keras.
 
 ""Sebab Benoku sudah tumbuh menjadi Benomu, dan ia sama denganmu terjebak dalam kehampaan waktu dan ruang.""
 
 Anak itu mengangkat tanganku yang terasa lemas.
 
 ""Lihat cincin kawin 'mu!""
 
 Aku memandang jari tanganku dengan seksama, benar! Terselip cincin kawin yang aku beli mendadak dengan Beno dulu.
 ""Dimana aku bisa mencari Benoku dan juga Benomu?"" aku berusaha menggerakan tulang ekorku untuk bangkit tapi anak itu menahanku.
 
 ""Sabar, dengarlah dengan baik-baik.""
 
 Aku tidak mendengar apa-apa, anak itu merapatkan jari telunjuknya yang mungil dan menekannya pada bibir mungilnya. Aku mencoba menenangkan diriku dan mengambil beberapa nafas panjang seperti persiapan yang biasanya aku lakukan sebelum naik ke atas panggung, berusaha menenangkan keriuhan dan deburan kecemasan dalam pikiranku. Aku dengar seperti ada suara dengungan lebah yang mendekat ke ujung kupingku.
 
 ***
 
 Para suster jaga berlari dengan terburu-buru ke salah satu ruangan yang selama ini ditempati oleh sepasang pengantin muda yang sudah terbaring koma selama 6 tahun belakangan ini. Waluyo yang tiap hari selalu rutin mengunjungi kamar itu dengan jalan tertatih penuh dengan beban penyesalan di masa tuanya. mempercepat langkah kakinya saat melihat para suster dengan langkah bergegas pergi ke kamar anak kandung dan anak tirinya. Waluyo tidak diberi izin masuk, la dibiarkan menunggu di depan kamar dengan tangan yang bergetar di ujung tongkat kayu berukir kepala elang yang selalu setia menemani langkah kakinya selama 2 tahun belakangan. Sekarang keluarga yang dimilikinya hanyalah tinggal Niki dan Beno seorang, istrinya meninggal 4 tahun yang lalu karena kesedihan yang tak kunjung habisnya melihat anak bungsunya tidak kunjung bangun dari tidurnya yang pa",,https://www.storial.co/book/kamu-tidak-pernah-sendiri/1,
